{
  "version": 1,
  "id": "c050921da983434589a4412dfc9ade1f",
  "kind": "classification",
  "started_at": "2026-10-07T06:38:45.425242Z",
  "finished_at": "2026-10-07T06:39:13.644872+00:00",
  "model": "deepseek-flash",
  "attempted_projects": 100,
  "accepted_projects": 80,
  "failed_projects": 20,
  "failures": [
    {
      "repository_id": 119907244,
      "reason": "schema"
    },
    {
      "repository_id": 366979357,
      "reason": "schema"
    },
    {
      "repository_id": 771225421,
      "reason": "schema"
    },
    {
      "repository_id": 1343773044,
      "reason": "schema"
    },
    {
      "repository_id": 1344577244,
      "reason": "schema"
    },
    {
      "repository_id": 1347015929,
      "reason": "schema"
    },
    {
      "repository_id": 1348317515,
      "reason": "schema"
    },
    {
      "repository_id": 1348326319,
      "reason": "schema"
    },
    {
      "repository_id": 1348460133,
      "reason": "schema"
    },
    {
      "repository_id": 1349158669,
      "reason": "schema"
    },
    {
      "repository_id": 1351896721,
      "reason": "schema"
    },
    {
      "repository_id": 1353045656,
      "reason": "schema"
    },
    {
      "repository_id": 1353845349,
      "reason": "schema"
    },
    {
      "repository_id": 1354666234,
      "reason": "schema"
    },
    {
      "repository_id": 1356717536,
      "reason": "schema"
    },
    {
      "repository_id": 1358300780,
      "reason": "schema"
    },
    {
      "repository_id": 1358761059,
      "reason": "schema"
    },
    {
      "repository_id": 1360363191,
      "reason": "schema"
    },
    {
      "repository_id": 1361798895,
      "reason": "schema"
    },
    {
      "repository_id": 1363788649,
      "reason": "schema"
    }
  ],
  "requests": 8,
  "usage_responses": 8,
  "unknown_usage_requests": 0,
  "usage_complete": true,
  "observed_tokens": {
    "prompt_tokens": 30549,
    "completion_tokens": 5593,
    "cache_hit_tokens": 17152,
    "cache_miss_tokens": 13397
  },
  "request_errors": {
    "invalid_response": 4
  },
  "estimated_cost": {
    "currency": "USD",
    "min": "0.005416806",
    "max": "0.010833612"
  },
  "pricing": {
    "source": "https://api-docs.deepseek.com/quick_start/pricing",
    "verified_on": "2026-09-24",
    "valid_until": "2026-10-24",
    "currency": "USD",
    "cache_hit": [
      "0.003",
      "0.006"
    ],
    "cache_miss": [
      "0.15",
      "0.3"
    ],
    "output": [
      "0.6",
      "1.2"
    ]
  },
  "pricing_status": "estimated_range",
  "billing_note": "估算区间并非账单；缺失用量或过期价格不计算费用。"
}
