{
  "version": 1,
  "id": "4182ee32db6542b1a1685e750ed4f719",
  "kind": "localization",
  "started_at": "2026-10-08T07:04:07.521126Z",
  "finished_at": "2026-10-08T07:04:12.651280+00:00",
  "model": "deepseek-flash",
  "attempted_projects": 7,
  "accepted_projects": 6,
  "failed_projects": 1,
  "failures": [
    {
      "repository_id": 1351626350,
      "reason": "missing_verbatim"
    }
  ],
  "requests": 2,
  "usage_responses": 2,
  "unknown_usage_requests": 0,
  "usage_complete": true,
  "observed_tokens": {
    "prompt_tokens": 2002,
    "completion_tokens": 568,
    "cache_hit_tokens": 896,
    "cache_miss_tokens": 1106
  },
  "request_errors": {},
  "estimated_cost": {
    "currency": "USD",
    "min": "0.000509388",
    "max": "0.001018776"
  },
  "pricing": {
    "source": "https://api-docs.deepseek.com/quick_start/pricing",
    "verified_on": "2026-09-24",
    "valid_until": "2026-10-24",
    "currency": "USD",
    "cache_hit": [
      "0.003",
      "0.006"
    ],
    "cache_miss": [
      "0.15",
      "0.3"
    ],
    "output": [
      "0.6",
      "1.2"
    ]
  },
  "pricing_status": "estimated_range",
  "billing_note": "估算区间并非账单；缺失用量或过期价格不计算费用。"
}
